冰轮炫光、月光石手杖、银辉之翼、月灵之翼,126
圆桌骑士炫光、国王背饰、圆桌骑士头饰、皇后背饰,126
星光发型(男)、星光服饰(男)、誓约之心背饰、全息投影炫光,126
星舰统帅发型(男)、星舰统帅服饰(男)、誓约之心背饰、全息投影炫光,126
机械手持、蒸汽手持、蒸汽动力背饰、蒸汽朋克炫光,126
瀚海霓裳发型(女)、瀚海霓裳服饰(女)、瀚海霓裳面饰、流金之沙炫光,126
机械之心帽、机械之心装、蒸汽动力背饰,125
机械之灵帽、机械之灵装、蒸汽朋克炫光,125
沧海明镜面饰、沧海明月背饰、沧海遗珠炫光,125
浪漫狮子面饰、绚烂星空炫光、浪漫狮子头饰,125
瀚海霓裳发型(男)、瀚海霓裳服饰(男)、青金八翼,125
盛装罗密欧发型、盛装罗密欧服饰、暮光圣翼,125
仲夏星芒炫光、典礼之星手杖、暮光圣翼、晓色圣翼,124
十字芒星面饰、典礼之星手杖,124
圆桌骑士发型(女)、圆桌骑士服饰(女)、圆桌骑士头饰、皇后背饰,124
圆桌骑士发型(男)、圆桌骑士服饰(男)、单手剑、国王背饰,124
星光发型(女)、星光服饰(女)、探索之心背饰、星光夺宝面饰,124
星舰统帅发型(女)、星舰统帅服饰(女)、探索之心背饰、星际航行面饰,124
沧海遗珠发型(女)、沧海遗珠服饰(女),124
沧海遗珠发型(男)、沧海遗珠服饰(男)、沧海遗珠手持、沧海明辉背饰,124
蒸汽手持、机械手持,124
金兔兔手杖、金冠炫光、晶心云水翼、晶心罗兰翼,124
金兔限定套装(女)、晶心罗兰翼,124
金萝卜头饰、金兔兔面饰,124
月灵之光发型、月灵之光服饰、月灵之翼,123
浪漫狮子发型(女)、浪漫狮子服饰(女)、热情之狮背饰,123
绮梦朱丽叶发型、绮梦朱丽叶服饰、晓色圣翼,123
银辉之梦发型、银辉之梦服饰、银辉之翼,123
冷月碧华眼镜、月光石手杖,122
油灯头饰、油灯背饰,122
金兔限定套装(男)、晶心云水翼,122
一步生花炫光、心月狐锦裙、心月狐锦袍、六尾背饰,112
冬日圣诞炫光、狂欢派对礼裙、狂欢派对礼服、比翼双飞背饰,112
星空旅者发型(女)、星空旅者服饰(女)、星空旅者炫光、星空旅者气球,112
星空旅者发型(男)、星空旅者服饰(男)、星空旅者背饰、星空旅者头饰,112
海之守护炫光、海之灵服饰(男)、海之灵服饰(女)、海之守护背饰,112
清凉一夏发型(女)、清凉一夏衣服(女)、清凉一夏炫光、清凉一夏气球,112
清凉一夏发型(男)、清凉一夏衣服(男)、清凉一夏背饰、清凉一夏头饰,112
甜梦回声装、童真浣熊帽、甜梦回响装、玩偶手杖,112
蛮族勇者发型(女)、蛮族勇者服饰(女)、蛮族战斧炫光、蛮族精神气球,112
超能炫光、超能少年服饰(男)、超能少年服饰(女)、超能背饰,112
魔渊炫光、刀螂战服(女)、刀螂战服(男)、极刃刀翅,112
黄金蛇炫光、木乃伊女装、木乃伊男装、埃及神秘翅膀,112
伪装者头套、伪装者战服、火线尖兵炫光,111
圣盾炫光、圣骑士面具、圣骑士大锤,111
沙漠盾牌背饰、沙漠刺客面饰、沙漠刺客匕首,111
玉狐假面、心月狐钿花、心月狐垂髫,111
白槿初绽头饰、羽叶华冠、羽叶金冠,111
西瓜棒冰头饰、百果蓝丝绒男发、百果蓝丝绒女发,111
超能奖杯、超能少年发型(男)、超能少年发型(女),111
追猎者头饰、刀螂战盔(女)、刀螂战盔(男),111
酒坛子、张飞面具、丈八蛇矛,111
乖乖兔发型(女)、乖乖兔服饰(女),110
乖乖兔发型(男)、乖乖兔服饰(男),110
什锦蛋糕炫光、彩虹慕斯T恤、奶油戚风舞裙、甜心圣代背饰,110
冰淇淋圣代头饰、稚气浣熊帽,110
悲鸣结晶炫光、古龙铠甲(女)、古龙铠甲(男)、龙之翼,110
月下华冠发型、月下猩红衣,110
月下蔷薇发型、月下蔷薇裙,110
炽焰炫光、炽焰翼、炽焰火、炽焰日轮,110
狂热节拍炫光、电玩女神服装、电玩小子服装、弹幕达人背饰,110
琪花玉树炫光、繁花咏叹、繁花絮语、瑶草琪花背饰,110
糖果星球炫光、太空喷气背包、防护玻璃面罩、火箭模型手持,110
舞蹈氛围炫光、舞蹈天王服饰、舞蹈天后服饰、舞后背饰,110
节奏电音炫光、迷幻天后服装、派对之王羽翼、电音王子夹克,110
蔷薇诱惑面饰、炽蔷薇炫光、绯红之翼、命运蔷薇杖,110
蛮族勇者发型(男)、蛮族勇者服饰(男)、蛮族信仰背饰、蛮族精神气球,110
赏金猎人发型(女)、赏金猎人服饰(女),110
赏金猎人发型(男)、赏金猎人服饰(男),110
转轮机枪背饰、枪弹起舞炫光、赏金猎人假面、猎人气球,110
麦穗面具、麦穗气球、麦穗手杖、青龙炫光,110
像素高玩眼镜、电玩女神发型、电玩小子发型,109
古龙头饰、古龙头盔(女)、古龙头盔(男),109
埃及神秘头饰、古埃及王后冠、古埃及法老冠,109
太空喷气背包、防护玻璃面罩、火箭模型手持,109
宇宙球灯头饰、舞蹈天王发型、舞蹈天后发型,109
怦然心动头饰、狂欢派对之花、狂欢派对之冠,109
曲调飞扬面饰、电音王子发型、迷幻天后发型,109
海之守护头饰、海之灵发型(男)、海之灵发型(女),109
石之心、石之臂,108
DJ眼镜、DJ舞台炫光、DJ音响、DJ麦克风,99
武圣炫光、武圣护背旗、武圣头饰、武圣面饰,99
等离子激荡炫光、信息终端背饰、等离子头饰,98
DJ眼镜、DJ麦克风,97
加百列面饰、加百列气球、加百列臻品炫光、加百列头饰,97
太阳神气球、酋长头饰、酋长面饰、酋长气球,97
帝皇五行炫光、帝皇侠翅膀、帝皇侠面具、帝皇侠气球,97
4周年炫光、4周年背饰、4周年头饰、4周年手持,87
传令官手持、传令官炫光、传令官船长黑喷漆、传令官船长黄喷漆,87
太空探险者气球、帮帮号头饰、帮帮号面饰、帮帮号气球,87
太空研究员帽(男)、太空研究员服(男)、卫星雷达手持、穿越之门炫光,87
太空科技头饰、太空科技面饰、科技锤子手持、水星气球,87
巨兽气球、圣剑头饰、圣剑面饰、圣剑气球,87
幻彩帽(女)、海月服(女)、海月水母背包、精灵炫光,87
心动萌兔套装-男发型、心动萌兔套装-男服装、心动萌兔面饰、心动萌兔花束,87
流氓兔粉丝套装(女)、白色渔夫帽(女)、流氓兔的马桶塞、流氓兔夏日炫光,87
清洁炫光、托盘背饰、循环头饰、希望之星面饰,87
羽箭手持、象棋炫光、束发冠头饰、盔甲面饰,87
警灯头饰、记录仪面饰、星际警灯炫光、星际警察布莱恩黄喷漆,87
飞天套装帽(女)、飞天套装服(女)、飞天彩带背饰、飞天面纱,87
Q刘备气球、Q张飞气球、刘备浅蓝漆,86
假面骑士面饰、骑士宝剑手持、冠军骑士头饰,86
汉服套装发型(女)、汉服套装服饰(女)、小乔扇子背饰,86
爱心手持、爱心气球、爱心炫光,86
王者之剑背饰、审判炫光、蔷薇气球,86
皮蛋印花T恤(蓝)、黑妞印花T恤(粉)、小乖炫光,86
章鱼触手、鱼钩护目镜、海星头饰,86
绿洲炫光、树人麻吉黄色喷漆、树人麻吉浅蓝喷漆,86
考古铲手持、探照灯气球、水壶气球,86
草人手持、八阵图炫光、兵书背饰,86
贝洛炫光、阿喵背饰、阿喵投影头饰,86
铛铛面饰、真·猫爪气球、贝洛炫光,86
阿特拉斯浅蓝喷漆、阿特拉斯墨色喷漆、阿特拉斯银色喷漆,86
魔能晶石头饰、魔法圣杯背饰、月光魔法阵炫光,86
1号古兵器气球、2号古兵器气球,85
4周年套装帽(女)、4周年套装服(女),85
4周年套装帽(男)、4周年套装服(男),85
三角2号气球、荧光棒手持,85
不倒翁宝宝头饰、不倒翁宝宝面饰,85
中世纪竞技头套(男)、中世纪竞技服饰(男),85
休闲夹克(白)、休闲羽绒服(白),85
古埃及套装帽(女)、古埃及套装服(女),85
古埃及套装帽(男)、古埃及套装服(男),85
古风竞技头套(女)、古风竞技套装(女),85
古风竞技头套(男)、古风竞技套装(男),85
吉祥如意套装发型(女)、吉祥如意套装服饰(女),85
夏日小背头、夏日沙滩装,85
太空研究员帽(女)、太空研究员服(女)、机械生命面饰、太空检测仪背饰,85
太空竞技头套(男)、太空竞技套装(男),85
奇异章鱼头套(男)、奇异章鱼套装(男),85
守护套装发型(女)、守护套装服饰(女),85
守护套装发型(男)、守护套装服饰(男),85
审判炫光、王者之剑背饰、蔷薇头饰、王之面饰,85
心动萌兔套装-女发型、心动萌兔套装-女服装,85
恭喜发财套装发型(男)、恭喜发财套装服饰(男),85
木星气球、水星气球,85
极光剑、极光盾、召唤器头饰、小小帝皇气球,85
沙漠观光头套(男)、沙漠观光套装(男),85
活力沙滩发型(女)、活力沙滩服饰(女),85
流氓兔粉丝套装(男)、白色渔夫帽(男)、流氓兔背包、黄金马桶塞,85
流氓兔防护头盔、流氓兔睡眠眼罩,85
淑女舞会帽(女)、淑女舞会裙(女),85
福禄新春发型(女)、福兔贺岁服(女),85
福禄新春发型(男)、福兔贺岁服(男)、福禄寿背饰、福禄寿头饰,85
蝶恋花发髻、天水碧纱裙,85
袜子气球、姜饼人气球,85
贵族绅士礼帽(男)、贵族绅士礼服(男),85
赤兔气球、傀木人头饰、傀木人面饰、傀木人气球,85
遮阳帽(女)、春日休闲服(女),85
酷黑竞技头套(女)、酷黑竞技套装(女),85
阿特机械臂背装、宇宙能源炫光、阿特储能面饰、克洛诺斯头饰,85
飘逸的丸子头、粉色棒球装,85
骑士1号气球、骑士2号气球,85
龟甲气球、孔明灯气球,85
三角1号气球、金属特制面饰、小小兔耳头饰,84
傀木人头饰、傀木人面饰、傀木人气球,84
古代特制面饰、古兵器手持、古代特制头饰,84
数显面饰、等离子气球、库伢雪色喷漆,84
汉服套装发型(男)、汉服套装服饰(男)、周瑜气球,84
电风扇手持、扇子手持、荷叶头饰,84
精灵炫光、雪人头套、雪人连体衣,84
飞天套装帽(男)、飞天套装服(男)、司南头饰,84
小羊驼炫光、咩咩咩头饰,83
幻彩帽(男)、海月服(男),83
武圣气球、关云长浅蓝喷漆,83
沙漠旅者发型(女)、沙漠旅者服饰(女),83
沙漠旅者发型(男)、沙漠旅者服饰(男),83
炼金手杖、炼金法阵炫光,83
繁星点点服饰(女)、黑妞炫光,83
繁星点点服饰(男)、黑妞炫光,83
绿水灵面饰、大胡子面饰,83
好运女神背饰、Jackpot炫光、头彩面饰、转运头饰,73
燃擎源力发型(男)、燃擎源力战服(男)、燃擎之源头饰、燃擎之源面饰,73
篮球气球、足球气球、排球气球、乒乓气球,73
超凡动力背饰、粒子聚能炫光、立体显影头饰、智能分析眼镜,73
黑晶伞、暗夜玫瑰炫光、蓝晶核心、蓝晶蝶面饰,73
R军团头盔、R军团战服、灯光秀炫光,72
储能背饰、火阵炫光、真视之眼,72
祥龙翱翔背饰、祥龙在天炫光、龙晶石头饰,72
邪龙翅膀、龙力封印炫光、龙之晶冠,72
2022KLC助威头盔(女)、2022KLC助威战服(女),71
R军团头盔、R军团战服,71
助推背饰、橙色闪光炫光、多功能头饰、破碎时空面饰,71
危险侍女发型、危险侍女服装,71
哈士奇头套、哈士奇服饰,71
团子渔夫帽(女)、团子背带裤(女),71
奇趣麋鹿帽(女)、奇趣麋鹿裙(女),71
少女猫帽、少女猫装,71
恐龙爱好者帽、恐龙爱好者衣,71
招财进宝帽、招财进宝装,71
捣蛋魔女发型、捣蛋魔女服装,71
星梦情缘发型(女)、星梦情缘服饰(女),71
月亮宝贝发型、月亮宝贝短衫,71
林中冒险帽(女)、林中冒险装(女),71
熊熊帽、熊熊服饰,71
燃擎源力发型(女)、燃擎源力战服(女),71
狂野猎手发型、狂野猎手装,71
纸杯蛋糕头饰、彩虹糖衬裙,71
绿茵宝贝发型、绿茵宝贝服装,71
赛事摄影发型、赛事摄影服饰、赛事主播发型、赛事主播服饰,71
赛道救援发型(女)、赛道救援服饰(女),71
足球头饰、足球号角、足球眼镜、足球炫光,71
野性丛林发型、野性丛林装,71
钢甲作战头盔、钢甲作战服,71
马戏小丑发型(男)、马戏小丑服饰(男),71
鸭鸭帽、鸭鸭服饰,71
嘟嘟背饰、魅力四射炫光、恶魔浮动面饰,70
小青蛙头饰、新手鱼竿、蛙蛙荷塘炫光,70
福虎迎春帽(男)、福虎迎春服(男)、福禄寿背饰,70
荒野领主背饰、猩红魅影炫光、洞察眼镜,70
野性丛林发型、野性丛林装、牵牛花开炫光,70
马戏小丑发型(男)、马戏小丑服饰(男)、聚光灯炫光,70
骑士护卫背饰、金闪闪炫光、王者之冠,70
N能量背饰、N标志头饰、黑色力量炫光、N力量面饰,69
感恩火鸡帽(女)、南瓜派冲锋衣、美味烤肉背饰、烤肉炫光,69
野马护目镜、野性动力炫光,69
感恩火鸡帽(男)、南瓜派夹克、烛光晚餐炫光,68
时空猎人服饰、时空猎人发型、未来面饰,68
特种部队头盔、军事防弹衣、军用背包背饰,68
突袭者爆炸头、突袭者皮裙(女)、急救背包,68
苏格兰软帽、苏格兰方格裙、苏格兰风笛背饰,68
迷璘夜翼、虹光战术目镜、霓锋暗影炫光,68
P1联赛无畏帽(女)、P1联赛无畏服(女),67
兔子小姐发饰、兔子小姐服饰,67
半翼白天使、半翼黑天使,67
嘻哈帽、嘻哈女孩服饰,67
壕气冲天发饰、壕气冲天服饰,67
夏日清凉双马尾、夏日清凉泳装,67
多维鞘翅背饰、时空壁障炫光、洞察者眼镜、异空雷达头饰,67
天行者发型、天行者套装,67
宇航头盔(女)、宇航服(女),67
少女包包头、梦幻少女装,67
少女海魂头巾、少女海魂衫,67
平安夜之星帽饰、平安夜之星服饰,67
幻光魅影发型(女)、幻光魅影装(女),67
战争侍女发型、战争侍女套装,67
探险女郎发型、探险女郎服饰,67
探险队长发型、探险队长服饰,67
摇滚达人套装、说唱达人套装,67
斑点狗发型、汪汪休闲西装,67
春节包包头、荷花翠旗袍,67
朝花夕拾发饰、朝花夕拾服饰,67
极地毛线帽(女)、极地冒险服(女),67
极地毛线帽(男)、极地冒险服(男),67
极限挑战发型(女)、极限挑战战服(女),67
浪漫枫情帽(男)、浪漫枫情装(男),67
海滨DJ发型、海滨DJ装,67
灵动少女发型、紫心吊带裙,67
燃擎一夏头盔、燃擎一夏装(男),67
白色校园帽、白色校园套裙,67
皇家海军帽(女)、皇家海军服(女),67
皇家海军帽(男)、皇家海军服(男),67
禁止超越帽、禁止超越装,67
童年花苞头、童年背带裙,67
粉色心动帽(女)、五彩时光装(女),67
粉色渔夫帽(女)、粉色棒球衫(女),67
经典结婚礼服、经典婚纱,67
胜之队赛车帽、胜之队比赛服,67
虎头帽(女)、虎绣衣(女),67
虎头帽(男)、虎绣衣(男),67
街舞少年头饰、街舞少年服饰,67
赛博少女发型、赛博少女服装,67
金牛纳福帽(女)、金牛纳福装(女),67
阿狸的祈望、阿狸的呓语,67
高歌任侠背饰、电子游侠炫光、网络侠影头饰、网络侠影面饰,67
鸳鸯软帽(女)、粉色衷心罩衫,67
鸳鸯软帽(男)、蓝色衷心罩衫,67
黑帮教父礼帽、黑帮教父西装、黑帮教父头饰、黑帮教父眼镜,67
鼠鼠生威发型、鼠鼠生威装,67
人鱼的鳍饰、人鱼的尾裙、海星面饰,66
动力拳套背饰、激光衍射准镜、机甲守备炫光,66
宝马摩托头盔(女)、宝马骑行套装(女)、宝马摩托车气球,66
小魔女发型、小魔女服饰、小魔女背饰,66
未来机甲之翼、相控雷达头饰、神秘地带炫光,66
浪漫枫情帽(女)、浪漫枫情装(女)、玫瑰花炫光,66
烈焰铠甲之翼、烈焰预警头饰、烈焰燎原炫光,66
煤球猫发型、猫咪连衣裙、尚方宝剑背饰,66
燃擎一夏头盔、燃擎一夏发型(男)、燃擎一夏装(男),66
燎原狱火发饰、燎原狱火服饰、燎原狱火面饰,66
经典结婚礼服、出错的结婚礼服,65
